Source_Title,Community,Source_Date,URL,Record_Count
Anker 735 wall prongs so thin the device falls out,r/anker,2022-08-30,https://www.reddit.com/r/anker/comments/x1og80/anker_735_wall_prongs_so_thin_the_device_falls/,2
My travel plug keeps falling out,r/AskElectricians,2024-03-24,https://www.reddit.com/r/AskElectricians/comments/1bmitef/my_travel_plug_keeps_falling_out_the_sockets_are/,4
Solution for loose electrical outlets,r/unitedairlines,2023-06-26,https://www.reddit.com/r/unitedairlines/comments/14i8wgg/solution_for_loose_electrical_outlets/,5
How many onebaggers carry universal adapters,r/onebag,2024-02-04,https://www.reddit.com/r/onebag/comments/1ai3pbg/how_many_of_those_onebagging_it_overseas_carry/,7
Hacks for loose in-flight outlets,r/delta,2023-12,https://www.reddit.com/r/delta/comments/18miluo/hacks_for_loose_in_flight_outlets/,5
All-in-one or individual travel adapters,r/travel,2025,https://www.reddit.com/r/travel/comments/1ir3ymv/travel_adapters_do_you_prefer_the_all_in_one_or/,5
Direct wall plug or charger with lead,r/onebag,2025-07-24,https://www.reddit.com/r/onebag/comments/1m85ov5/which_type_of_the_charger_would_work_better_in/,2
Travel adaptor?,r/onebag,2022-07-11,https://www.reddit.com/r/onebag/comments/vwpl0c/travel_adaptor/,3
Why travel adapters also serve as USB docks,r/onebag,2024,https://www.reddit.com/r/onebag/comments/1ftdq54/why_is_there_such_a_big_market_for_travel_plug/,3
Travel adapter multi-port fast charger for Asia,r/onebag,2025,https://www.reddit.com/r/onebag/comments/1pkrugn/travel_adapter_multi_port_fast_gan_charger/,4
Plug adapter from worldwide to US,r/onebag,2026-06,https://www.reddit.com/r/onebag/comments/1toyz7y/please_drop_your_recs_for_plug_adapter_from/,2
Travel adapter with powerful USB ports,r/onebag,2018,https://www.reddit.com/r/onebag/comments/9jd958/looking_for_best_travel_adapter_with_powerful_usb/,3
USB-C only travel chargers,r/onebag,2024,https://www.reddit.com/r/onebag/comments/1fkkct0/usbc_only_travel_chargers/,5
Travel adapters vs travel adapter,r/onebag,2023,https://www.reddit.com/r/onebag/comments/17ganrl/deciding_on_travel_adapters_vs_travel_adapter/,2
Travel adapters - do not overthink it,r/onebag,2025,https://www.reddit.com/r/onebag/comments/1n00se7/travel_adapters_dont_over_think_it/,1
Do multiport USB-C chargers slow down,r/UsbCHardware,2023,https://www.reddit.com/r/UsbCHardware/comments/17s01az/do_multiport_usb_c_chargers_slow_down_if_multiple/,2
Multi-port charger temporarily cuts power,r/UsbCHardware,2021,https://www.reddit.com/r/UsbCHardware/comments/r9r1nf/normal_for_usb_c_multiport_chargers_to/,1
Best way to charge multiple devices in hotels,r/digitalnomad,2026,https://www.reddit.com/r/digitalnomad/comments/1rsdfee/best_way_to_charge_multiple_devices_in_hotels/,2
Hotel USB ports question,r/hotels,2026,https://www.reddit.com/r/hotels/comments/1sgt4mo/usb_ports_question_not_a_complaint/,4
Why US/CAD to EU adapter becomes hot,r/travel,2025,https://www.reddit.com/r/travel/comments/1l9t0pl/why_do_uscad_to_eu_adapter_becoming_hot_when_used/,1
Using a local USB charger instead of travel adapter,r/TravelHacks,2025,https://www.reddit.com/r/TravelHacks/comments/1ohddg2/using_a_local_usb_charger_instead_of_a_travel/,1
Two devices at once without dropping power,r/UsbCHardware,2023,https://www.reddit.com/r/UsbCHardware/comments/189wzdf/is_there_a_usb_c_charger_that_can_charges_two/,1
Hotel room has no plug sockets by bed,r/mildlyinfuriating,2026,https://www.reddit.com/r/mildlyinfuriating/comments/1sxa36y/my_hotel_room_doesnt_have_any_plug_sockets_by_the/,1
Japan travel adapter plus multi-outlet,r/UsbCHardware,2023,https://www.reddit.com/r/UsbCHardware/comments/15jkziy/traveling_to_japan_question_about_travel_adapter/,1
Travel adapter converter,r/onebag,2024,https://www.reddit.com/r/onebag/comments/1ddhjxq/travel_adapterconverter/,1
Charger falls out of outlets in Thailand,r/ThailandTourism,2025-01-30,https://www.reddit.com/r/ThailandTourism/comments/1idlerb/is_there_some_kind_of_secret_to_getting_your/,1
Travel adaptor too loose,r/askanelectrician,2021-11-21,https://www.reddit.com/r/askanelectrician/comments/qymdd9/how_can_i_solve_this_travel_adaptor_too_loose/,1
Travel adapter stuck in charger,r/AskElectricians,2023-10-16,https://www.reddit.com/r/AskElectricians/comments/178xpz7/travel_adapter_stuck_in_charger_any_tipshacks/,1
Ideal charging setup for family travel,r/onebag,2024-05-11,https://www.reddit.com/r/onebag/comments/1cpifcn/ideal_chargingcord_setup_for_extended_travel/,1
Power outlets over-worn and chargers fall out,r/AlaskaAirlines,2026,https://www.reddit.com/r/AlaskaAirlines/comments/1qo6f80/power_outlets_overworn_and_chargers_fall_out/,1
United seat power ports too loose,r/unitedairlines,2025-02-26,https://www.reddit.com/r/unitedairlines/comments/1iycf4n/united_seat_power_ports_are_old_and_often_too/,1
Inflight power hack,r/unitedairlines,2024-08-13,https://www.reddit.com/r/unitedairlines/comments/1erb990/inflight_power_hack_loose_power_outlets/,1
Wall charger that stays in,r/unitedairlines,2025,https://www.reddit.com/r/unitedairlines/comments/1onqi6f/wall_charger_that_stays_in/,1
Multiport charger that does not interrupt power,r/UsbCHardware,2026,https://www.reddit.com/r/UsbCHardware/comments/1roxfy3/looking_for_a_multiport_usb_charger_that_doesnt/,1
Two-port charger for slower charging,r/UsbCHardware,2023,https://www.reddit.com/r/UsbCHardware/comments/16wckd2/looking_for_a_twoport_usbc_charger_that_will_slow/,1
International travel adapters with Type-C,r/UsbCHardware,2019,https://www.reddit.com/r/UsbCHardware/comments/bhu1ab/any_recommendations_for_international_travel/,1
Best multi-port charger for multiple devices,r/UsbCHardware,2025,https://www.reddit.com/r/UsbCHardware/comments/1k6vuw0/whats_the_best_multiport_charger_for_charging/,1
